{"applied_before_coordinate_binding":false,"capture_revision_id":"81e4985b-3169-49a4-b76c-8316a7145117","capture_session_id":"0f936474-e29d-415d-9691-b52faed6227b","configured_assets":[],"coordinate_space_id":"893addc6-b4b6-4cb4-8da2-67c64765ffa5","observations":[],"schema":"htdt.capture.reference-object-observations","schema_version":"1.0.0","selection":{"cap":4,"dropped":[],"requested":[]},"truncated_observation_count":0}